<tariffs xmlns:xsi="http://www.w3.org/2001/XMLSchema-instance" xmlns="http://www.example.com/tariffs" xsi:schemaLocation="http://www.example.com/tariffs tariff.xsd">
    <tariff name="Comfort Standard">
        <operator-name>Velcom</operator-name>
        <payroll>990</payroll>
        <call-prices>
            <within-network-call-price>3</within-network-call-price>
            <outside-network-call-price>13</outside-network-call-price>
            <stationary-call-price>13</stationary-call-price>
        </call-prices>
        <sms-price>4</sms-price>
        <parameter>
            <favourite-number>0</favourite-number>
            <charging>12-seconds</charging>
            <subscription-fee>500</subscription-fee>
        </parameter>
    </tariff>
    <tariff name="Comfort Super">
        <operator-name>Velcom</operator-name>
        <payroll>1490</payroll>
        <call-prices>
            <within-network-call-price>2</within-network-call-price>
            <outside-network-call-price>10</outside-network-call-price>
            <stationary-call-price>10</stationary-call-price>
        </call-prices>
        <sms-price>4</sms-price>
        <parameter>
            <favourite-number>0</favourite-number>
            <charging>12-seconds</charging>
            <subscription-fee>500</subscription-fee>
        </parameter>
    </tariff>
    <tariff name="Comfort Premium">
        <operator-name>Velcom</operator-name>
        <payroll>1690</payroll>
        <call-prices>
            <within-network-call-price>1</within-network-call-price>
            <outside-network-call-price>8</outside-network-call-price>
            <stationary-call-price>8</stationary-call-price>
        </call-prices>
        <sms-price>4</sms-price>
        <parameter>
            <favourite-number>0</favourite-number>
            <charging>12-seconds</charging>
            <subscription-fee>500</subscription-fee>
        </parameter>
    </tariff>
    <tariff name="Comfort Platinum">
        <operator-name>Velcom</operator-name>
        <payroll>2190</payroll>
        <call-prices>
            <within-network-call-price>0</within-network-call-price>
            <outside-network-call-price>8</outside-network-call-price>
            <stationary-call-price>8</stationary-call-price>
        </call-prices>
        <sms-price>4</sms-price>
        <parameter>
            <favourite-number>0</favourite-number>
            <charging>12-seconds</charging>
            <subscription-fee>500</subscription-fee>
        </parameter>
    </tariff>
    <tariff name="Smart Unlimited">
        <operator-name>Velcom</operator-name>
        <payroll>4990</payroll>
        <call-prices>
            <within-network-call-price>0</within-network-call-price>
            <outside-network-call-price>8</outside-network-call-price>
            <stationary-call-price>8</stationary-call-price>
        </call-prices>
        <sms-price>0</sms-price>
        <parameter>
            <favourite-number>0</favourite-number>
            <charging>12-seconds</charging>
            <subscription-fee>4000</subscription-fee>
        </parameter>
    </tariff>
    <tariff name="Business Class">
        <operator-name>Velcom</operator-name>
        <payroll>9990</payroll>
        <call-prices>
            <within-network-call-price>0</within-network-call-price>
            <outside-network-call-price>7</outside-network-call-price>
            <stationary-call-price>7</stationary-call-price>
        </call-prices>
        <sms-price>0</sms-price>
        <parameter>
            <favourite-number>0</favourite-number>
            <charging>12-seconds</charging>
            <subscription-fee>9990</subscription-fee>
        </parameter>
    </tariff>
    <!--6 tariffs in total-->
</tariffs>